<?xml version="1.0" encoding="UTF-8" standalone="yes"?>
<ese-file-realm xmlns:xsi="http://www.w3.org/2001/XMLSchema-instance"
                xsi:noNamespaceSchemaLocation="ese-file-realm.xsd">
    <mqtt>
        <!-- users are fetched via AUTHENTICATION_KEY-->
        <users>
            <user>
                <name>admin-user</name>
                <permissions>
                    <permission>
                        <topic>#</topic>
                        <qos>ALL</qos>
                        <activity>ALL</activity>
                        <retain>ALL</retain>
                        <shared-subscription>ALL</shared-subscription>
                        <shared-group>group-1</shared-group>
                    </permission>
                </permissions>
            </user>
        </users>

        <!-- roles are fetched via AUTHENTICATION_ROLE_KEY-->
        <roles>
            <role>
                <id>role-1</id>
                <permissions>
                    <permission>
                        <topic>topic-1</topic>
                        <qos>ALL</qos>
                        <activity>SUBSCRIBE</activity>
                    </permission>
                </permissions>
            </role>
        </roles>
    </mqtt>


    <control-center>
        <!-- list of available permissions:
               https://www.hivemq.com/docs/ese/latest/enterprise-security-extension/ese.html#control-center-access-control-permissions -->
        <users>
            <user>
                <name>cc-admin-user</name>
                <permissions>
                    <permission>HIVEMQ_SUPER_ADMIN</permission>
                </permissions>
            </user>
        </users>

        <roles>
            <role>
                <id>cc-backup-only-role</id>
                <permissions>
                    <permission>HIVEMQ_VIEW_PAGE_BACKUP</permission>
                </permissions>
            </role>
        </roles>
    </control-center>
</ese-file-realm>
